Shree Ram Hardware & Sanita..,+(91)-7567493500,4.4,10,"Rajmandir Complex, Kuwadva Road, Greenland Chowk, Rajkot - 360003, Near Sadguru Ashram",
Aricon Studio LLP,+(91)-8866775599,4.7,20,"Beside Vraj Hospital, Opposite Bank Of Baroda, 150 Feet Ring Road, Rajkot - 360005, Near Balaji Hall",
Bajrang Enterprise,+(91)-7817838180,5.0,5,"Mavdi By Pass Road, Khodiyar Industrial Area, Street No 1, Morbi Road, Rajkot - 360004, Opp.raghvirpan",
Chetan Hardware Stores,07947257770,4.5,324,"Canal Main Road, Canal Road, Rajkot - 360002, Near Dena Bank",
Wood Leaf Interiors,07947258649,5.0,1,"Opposite Maruti Suzuki Showroom, Tagore Road, Rajkot - 360002",
Redline Hardware Products,07947080925,4.7,21,"Bhojalram, 1-Ramnagar, Diamond Street, Kotharia, Rajkot - 360002, Near Kothariya Chokdi",
Santoshi Wooden Furniture,07947259234,5.0,1,"Real Prime Shop No. 124, Mavdi Main Road, Rajkot - 360004",
Ishaan Interior,+(91)-9825217177,4.0,4,"108, Nakshtra Heights, 150 Feet Ring Road, Rajkot - 360005, Opposite Raiya Telephone Exchange",
Uttam Hardware,+(91)-9377845145,4.6,21,"Shop No G-1 Krishna Complex-3, Nana Mava Main Road, Rajkot - 360005, Near Rajnagar Chowk",
Chamunda Ply And Hardware,07947077311,5.0,2,"Near Raj Bank, Shaktni Nagar, Mavdi Main Road, Rajkot - 360004",
